subj,run,item,list,category,sentence,joke ending,nonjoke ending,displayed,response,RT,question onset
0.0000,8.000,1,107,2,nonjoke,The difference between a good speaker and a bad one is often a nice,nap,diction,The difference between a good speaker and a bad one is often a nice diction.,<VisionEgg.WrappedText.WrappedText object at 0x10bdb2960>
8.0000,8.000,1,98,2,joke,"Nature has three ways of thinning the herd: drought, famine, and ",primaries,hunting,"Nature has three ways of thinning the herd: drought, famine, and primaries.",<VisionEgg.WrappedText.WrappedText object at 0x10bdb2640>
16.0000,2.000,fix
18.0000,8.000,1,150,2,joke,One way to keep pornography away from teenagers is to put it in a,textbook,cabinet,One way to keep pornography away from teenagers is to put it in a textbook.,<VisionEgg.WrappedText.WrappedText object at 0x10bdb2730>
26.0000,8.000,1,17,2,nonjoke,A committee keeps minutes and takes,hours,votes,A committee keeps minutes and takes votes.,<VisionEgg.WrappedText.WrappedText object at 0x10bdb27d0>
34.0000,8.000,1,130,2,joke,"This house comes with lots of extras, mostly",termites,upgrades,"This house comes with lots of extras, mostly termites.",<VisionEgg.WrappedText.WrappedText object at 0x10bdb2460>
42.0000,8.000,1,1,2,nonjoke,"When I asked how long he should cook the noodles, I said at least ten",inches,seconds,"When I asked how long he should cook the noodles, I said at least ten seconds.",<VisionEgg.WrappedText.WrappedText object at 0x10bdb25a0>
50.0000,2.000,fix
52.0000,8.000,1,37,2,nonjoke,"The cops claimed that the prisoner just decided to come clean, but most people think he was forced into the",bathtub,admission,"The cops claimed that the prisoner just decided to come clean, but most people think he was forced into the admission.",<VisionEgg.WrappedText.WrappedText object at 0x10bdb2550>
60.0000,2.000,fix
62.0000,8.000,1,135,2,nonjoke,"My mechanic couldn't fix my brakes, so he fixed my",horn,clutch,"My mechanic couldn't fix my brakes, so he fixed my clutch.",<VisionEgg.WrappedText.WrappedText object at 0x10bdb25f0>
70.0000,2.000,fix
72.0000,8.000,1,64,2,joke,The best way to stop an elephant from charging is to cut off its,credit,toes,The best way to stop an elephant from charging is to cut off its credit.,<VisionEgg.WrappedText.WrappedText object at 0x10bdb2780>
80.0000,2.000,fix
82.0000,8.000,1,125,2,nonjoke,I know one couple who got divorced and had to leave the house to the,attorney,daughter,I know one couple who got divorced and had to leave the house to the daughter.,<VisionEgg.WrappedText.WrappedText object at 0x10bdb26e0>
90.0000,8.000,1,153,2,nonjoke,The husband who catches his wife in the act is probably on the,trapeze,snoop,The husband who catches his wife in the act is probably on the snoop.,<VisionEgg.WrappedText.WrappedText object at 0x10bdb2500>
98.0000,2.000,fix
100.0000,8.000,1,85,2,nonjoke,"Frequent naps prevent old age, especially when taken while",driving,relaxed,"Frequent naps prevent old age, especially when taken while relaxed.",<VisionEgg.WrappedText.WrappedText object at 0x10bdb2690>
108.0000,8.000,1,28,2,joke,Her press agent was operated on for an ingrown,beeper,eyelash,Her press agent was operated on for an ingrown beeper.,<VisionEgg.WrappedText.WrappedText object at 0x10bdb2b40>
116.0000,6.000,fix
122.0000,8.000,1,151,2,nonjoke,One good turn gets most of the,blanket,profit,One good turn gets most of the profit.,<VisionEgg.WrappedText.WrappedText object at 0x10bdb2b90>
130.0000,8.000,fix
138.0000,8.000,1,93,2,nonjoke,"He is probably the best boxer in the country, but he always loses in the ",city,competition,"He is probably the best boxer in the country, but he always loses in the competition.",<VisionEgg.WrappedText.WrappedText object at 0x10bdb2c30>
146.0000,8.000,1,76,2,joke,"Parents support clubs for teenagers, especially when they lack other forms of",punishment,diversion,"Parents support clubs for teenagers, especially when they lack other forms of punishment.",<VisionEgg.WrappedText.WrappedText object at 0x10bdb2be0>
154.0000,8.000,1,74,2,joke,He's planning an extended vacation; he hopes to spend three weeks on his,couch,sailboat,He's planning an extended vacation; he hopes to spend three weeks on his couch.,<VisionEgg.WrappedText.WrappedText object at 0x10bdb2c80>
162.0000,6.000,fix
168.0000,8.000,1,115,2,nonjoke,"In the game of golf, nothing counts as much as your",opponent,drives,"In the game of golf, nothing counts as much as your drives.",<VisionEgg.WrappedText.WrappedText object at 0x10bdb2d20>
176.0000,8.000,1,102,2,joke,We live in a lovely suburb; it's just two miles beyond our,income,town,We live in a lovely suburb; it's just two miles beyond our income.,<VisionEgg.WrappedText.WrappedText object at 0x10bdb2cd0>
184.0000,8.000,1,156,2,joke,The only ones who want me for my body are,mosquitos,losers,The only ones who want me for my body are mosquitos.,<VisionEgg.WrappedText.WrappedText object at 0x10bdb2d70>
192.0000,2.000,fix
194.0000,8.000,1,143,2,nonjoke,Most of the people running for office are not politicians; they're,commuters,candidates,Most of the people running for office are not politicians; they're candidates.,<VisionEgg.WrappedText.WrappedText object at 0x10bdb2dc0>
202.0000,8.000,1,146,2,joke,"Love has its benefits, and they are usually called",alimony,memories,"Love has its benefits, and they are usually called alimony.",<VisionEgg.WrappedText.WrappedText object at 0x10bdb2e10>
210.0000,4.000,fix
214.0000,8.000,1,53,2,nonjoke,"By the time Mary had her fourteenth child, she'd run out of names to call her ",husband,offspring,"By the time Mary had her fourteenth child, she'd run out of names to call her offspring.",<VisionEgg.WrappedText.WrappedText object at 0x10bdb2e60>
222.0000,8.000,1,152,2,joke,"Many things run in families, especially",noses,strength,"Many things run in families, especially noses.",<VisionEgg.WrappedText.WrappedText object at 0x10bdb2eb0>
230.0000,4.000,fix
234.0000,8.000,1,22,2,joke,Our son brought home a note from school saying they need a written excuse for his,presence,tardiness,Our son brought home a note from school saying they need a written excuse for his presence.,<VisionEgg.WrappedText.WrappedText object at 0x10bdb2f00>
242.0000,2.000,fix
244.0000,8.000,1,3,2,nonjoke,A thoughtful wife has pork chops ready when her husband comes home from,fishing,working,A thoughtful wife has pork chops ready when her husband comes home from working.,<VisionEgg.WrappedText.WrappedText object at 0x10bdb2f50>
252.0000,6.000,fix
258.0000,8.000,1,67,2,nonjoke,The most prevalent form of legalized gambling is,elections,betting,The most prevalent form of legalized gambling is betting.,<VisionEgg.WrappedText.WrappedText object at 0x10bdb2fa0>
266.0000,2.000,fix
268.0000,8.000,1,147,2,nonjoke,"When we got divorced, my wife and I split the house; she got the",inside,kitchen,"When we got divorced, my wife and I split the house; she got the kitchen.",<VisionEgg.WrappedText.WrappedText object at 0x1130ed050>
276.0000,8.000,1,33,2,nonjoke,Some people think courtship is the first in a series of steps leading to ,divorce,romance,Some people think courtship is the first in a series of steps leading to romance.,<VisionEgg.WrappedText.WrappedText object at 0x1130ed0a0>
284.0000,22.000,fix
306.0000,8.000,1,43,2,nonjoke,"I asked him if he started out as an editor, and he said that years ago he used to be a ",boy,journalist,"I asked him if he started out as an editor, and he said that years ago he used to be a journalist.",<VisionEgg.WrappedText.WrappedText object at 0x1130ed140>
314.0000,8.000,1,25,2,nonjoke,The only thing money can't buy is,poverty,generosity,The only thing money can't buy is generosity.,<VisionEgg.WrappedText.WrappedText object at 0x1130ed0f0>
322.0000,8.000,1,106,2,joke,"Every time I wear my spring coat in the rain, it damages the",springs,fabric,"Every time I wear my spring coat in the rain, it damages the springs.",<VisionEgg.WrappedText.WrappedText object at 0x1130ed190>
330.0000,2.000,fix
332.0000,8.000,1,69,2,nonjoke,"When an irresistible force meets an immovable object, you get two very angry",women,entities,"When an irresistible force meets an immovable object, you get two very angry entities.",<VisionEgg.WrappedText.WrappedText object at 0x1130ed1e0>
340.0000,10.000,fix
350.0000,8.000,1,15,2,nonjoke,"When John bought a bulldog, it was no time at all before he had that dog eating out of his",leg,fingers,"When John bought a bulldog, it was no time at all before he had that dog eating out of his fingers.",<VisionEgg.WrappedText.WrappedText object at 0x1130ed230>
358.0000,6.000,fix
364.0000,8.000,1,66,2,joke,One good way to invest in the country is to buy a ,senator,business,One good way to invest in the country is to buy a senator.,<VisionEgg.WrappedText.WrappedText object at 0x1130ed280>
372.0000,8.000,1,113,2,nonjoke,Some people's only culture is,bacteria,radio,Some people's only culture is radio.,<VisionEgg.WrappedText.WrappedText object at 0x1130ed2d0>
380.0000,6.000,fix
386.0000,8.000,1,131,2,nonjoke,"Statistics indicate that Americans spend eighty million a year on games of chance, mostly",weddings, blackjack,"Statistics indicate that Americans spend eighty million a year on games of chance, mostly blackjack.",<VisionEgg.WrappedText.WrappedText object at 0x1130ed370>
394.0000,4.000,fix
398.0000,8.000,1,144,2,joke,The difference between a dog and fox is about five,beers,degrees,The difference between a dog and fox is about five beers.,<VisionEgg.WrappedText.WrappedText object at 0x1130ed320>
406.0000,4.000,fix
410.0000,8.000,1,101,2,nonjoke,"I got a car for my wife, and I thought it was a good",trade,choice,"I got a car for my wife, and I thought it was a good choice.",<VisionEgg.WrappedText.WrappedText object at 0x1130ed3c0>
418.0000,4.000,fix
422.0000,8.000,1,50,2,joke,The only time my father ever raised a hand to his children was in ,self- defense,discipline,The only time my father ever raised a hand to his children was in self- defense.,<VisionEgg.WrappedText.WrappedText object at 0x1130ed410>
430.0000,4.000,fix
434.0000,8.000,1,61,2,nonjoke,"For great vacation, put the kids in the back seat, and take a ",cruise,freeway,"For great vacation, put the kids in the back seat, and take a freeway.",<VisionEgg.WrappedText.WrappedText object at 0x1130ed460>
442.0000,8.000,1,58,2,joke,The woman who has her husband eating out of her hand must save a lot of,dishwashing,heartbreak,The woman who has her husband eating out of her hand must save a lot of dishwashing.,<VisionEgg.WrappedText.WrappedText object at 0x1130ed4b0>
450.0000,8.000,1,62,2,joke,"I can walk on water, but I stagger on ",alcohol,concrete,"I can walk on water, but I stagger on alcohol.",<VisionEgg.WrappedText.WrappedText object at 0x1130ed500>
458.0000,2.000,fix
460.0000,8.000,1,78,2,joke,My brother-in-law enjoys fixing things around the house so much he spent an hour last night just fixing our,drinks,stove,My brother-in-law enjoys fixing things around the house so much he spent an hour last night just fixing our drinks.,<VisionEgg.WrappedText.WrappedText object at 0x1130ed550>
468.0000,8.000,1,73,2,nonjoke,One thing that makes the world go round is,detours,greed,One thing that makes the world go round is greed.,<VisionEgg.WrappedText.WrappedText object at 0x1130ed5a0>
476.0000,2.000,fix
478.0000,8.000,1,138,2,joke,Modern science is amazing: garbage is now being made into,movies,gasoline,Modern science is amazing: garbage is now being made into movies.,<VisionEgg.WrappedText.WrappedText object at 0x1130ed5f0>
486.0000,22.000,fix
508.0000,8.000,1,10,2,joke,Nothing in the known universe travels faster than,gossip,radiation,Nothing in the known universe travels faster than gossip.,<VisionEgg.WrappedText.WrappedText object at 0x1130ed640>
516.0000,8.000,1,122,2,joke,"If you're filthy rich, sending your kids to college is a wonderful", cleaner,luxury,"If you're filthy rich, sending your kids to college is a wonderful cleaner.",<VisionEgg.WrappedText.WrappedText object at 0x1130ed690>
524.0000,2.000,fix
526.0000,8.000,1,52,2,joke,My wife did natural childbirth: no,makeup,anesthetic,My wife did natural childbirth: no makeup.,<VisionEgg.WrappedText.WrappedText object at 0x1130ed6e0>
534.0000,8.000,1,2,2,joke,"She went on a fourteen day diet, but she only lost two",weeks,ounces,"She went on a fourteen day diet, but she only lost two weeks.",<VisionEgg.WrappedText.WrappedText object at 0x1130ed780>
542.0000,2.000,fix
544.0000,8.000,1,6,2,joke,Sunday is the day we bow our heads and,putt,rest,Sunday is the day we bow our heads and putt.,<VisionEgg.WrappedText.WrappedText object at 0x1130ed730>
552.0000,10.000,fix
562.0000,8.000,1,70,2,joke,The best gift for the man who has everything is,penicillin,neckties,The best gift for the man who has everything is penicillin.,<VisionEgg.WrappedText.WrappedText object at 0x1130ed7d0>
