subj,run,item,list,category,sentence,joke ending,nonjoke ending,displayed,response,RT,question onset
0.0000,8.000,2,131,2,nonjoke,"Statistics indicate that Americans spend eighty million a year on games of chance, mostly",weddings, blackjack,"Statistics indicate that Americans spend eighty million a year on games of chance, mostly blackjack.",<VisionEgg.WrappedText.WrappedText object at 0x10c564d20>
8.0000,8.000,2,126,2,joke,My husband took the money we were saving to buy a new car and blew it all at the,laundry,tables,My husband took the money we were saving to buy a new car and blew it all at the laundry.,<VisionEgg.WrappedText.WrappedText object at 0x10c564cd0>
16.0000,2.000,fix
18.0000,8.000,2,42,2,joke,The best way to keep the milk from turning sour is to keep it in the,cow,cold,The best way to keep the milk from turning sour is to keep it in the cow.,<VisionEgg.WrappedText.WrappedText object at 0x10c564d70>
26.0000,8.000,2,31,2,nonjoke,"He told her he wasn't himself, and she said she'd noticed the",improvement,problem,"He told her he wasn't himself, and she said she'd noticed the problem.",<VisionEgg.WrappedText.WrappedText object at 0x10c564dc0>
34.0000,8.000,2,100,2,joke,"I hope this train stops at Grand Central because if it doesn't, there will be a ",crash,delay,"I hope this train stops at Grand Central because if it doesn't, there will be a crash.",<VisionEgg.WrappedText.WrappedText object at 0x10c564e10>
42.0000,8.000,2,15,2,nonjoke,"When John bought a bulldog, it was no time at all before he had that dog eating out of his",leg,fingers,"When John bought a bulldog, it was no time at all before he had that dog eating out of his fingers.",<VisionEgg.WrappedText.WrappedText object at 0x10c564e60>
50.0000,2.000,fix
52.0000,8.000,2,5,2,nonjoke,She read so much about the bad effects of cigarettes she decided to give up the,reading,habit,She read so much about the bad effects of cigarettes she decided to give up the habit.,<VisionEgg.WrappedText.WrappedText object at 0x10c564eb0>
60.0000,2.000,fix
62.0000,8.000,2,139,2,nonjoke,They redecorated the bar with new,drunks,wood,They redecorated the bar with new wood.,<VisionEgg.WrappedText.WrappedText object at 0x10c564f00>
70.0000,2.000,fix
72.0000,8.000,2,72,2,joke,The first two hundred story building opened in Chicago; it was a ,library,hotel,The first two hundred story building opened in Chicago; it was a library.,<VisionEgg.WrappedText.WrappedText object at 0x10c564fa0>
80.0000,2.000,fix
82.0000,8.000,2,49,2,nonjoke,One person who sure makes a long story short is my,editor,aunt,One person who sure makes a long story short is my aunt.,<VisionEgg.WrappedText.WrappedText object at 0x10c564f50>
90.0000,8.000,2,123,2,nonjoke,Too many girls believe that the chief foundation for true love is a large,stone,fortune,Too many girls believe that the chief foundation for true love is a large fortune.,<VisionEgg.WrappedText.WrappedText object at 0x113bc4050>
98.0000,2.000,fix
100.0000,8.000,2,129,2,nonjoke,The perfect companion to a vegetarian dinner is a ,steak,salad,The perfect companion to a vegetarian dinner is a salad.,<VisionEgg.WrappedText.WrappedText object at 0x113bc4140>
108.0000,8.000,2,146,2,joke,"Love has its benefits, and they are usually called",alimony,memories,"Love has its benefits, and they are usually called alimony.",<VisionEgg.WrappedText.WrappedText object at 0x113bc40a0>
116.0000,6.000,fix
122.0000,8.000,2,113,2,nonjoke,Some people's only culture is,bacteria,radio,Some people's only culture is radio.,<VisionEgg.WrappedText.WrappedText object at 0x113bc40f0>
130.0000,8.000,fix
138.0000,8.000,2,17,2,nonjoke,A committee keeps minutes and takes,hours,votes,A committee keeps minutes and takes votes.,<VisionEgg.WrappedText.WrappedText object at 0x113bc41e0>
146.0000,8.000,2,14,2,joke,He got a medal for bravery on the beach when he rescued a girl from a ,lifeguard,shipwreck,He got a medal for bravery on the beach when he rescued a girl from a lifeguard.,<VisionEgg.WrappedText.WrappedText object at 0x113bc4230>
154.0000,8.000,2,82,2,joke,"When it comes to keeping warm, nothing beats a thermal",brunette,parka,"When it comes to keeping warm, nothing beats a thermal brunette.",<VisionEgg.WrappedText.WrappedText object at 0x113bc4280>
162.0000,6.000,fix
168.0000,8.000,2,155,2,nonjoke,The show had one act that was really offbeat: the,singer,clowns,The show had one act that was really offbeat: the clowns.,<VisionEgg.WrappedText.WrappedText object at 0x113bc4190>
176.0000,8.000,2,148,2,joke,The best bargain I ever got was when I went to a family garage sale and bought a ,grandma,toaster,The best bargain I ever got was when I went to a family garage sale and bought a grandma.,<VisionEgg.WrappedText.WrappedText object at 0x113bc42d0>
184.0000,8.000,2,6,2,joke,Sunday is the day we bow our heads and,putt,rest,Sunday is the day we bow our heads and putt.,<VisionEgg.WrappedText.WrappedText object at 0x113bc4320>
192.0000,2.000,fix
194.0000,8.000,2,35,2,nonjoke,"Now that the Hollywood couple has ironed out the divorce settlement, they can finally go ahead with their",nuptials,careers,"Now that the Hollywood couple has ironed out the divorce settlement, they can finally go ahead with their careers.",<VisionEgg.WrappedText.WrappedText object at 0x113bc4370>
202.0000,8.000,2,124,2,joke,"I've got Parkinson's disease, and he's got", mine,gout,"I've got Parkinson's disease, and he's got mine.",<VisionEgg.WrappedText.WrappedText object at 0x113bc43c0>
210.0000,4.000,fix
214.0000,8.000,2,9,2,nonjoke,"I asked the woman at the party if she remembered me from last year, and she said she never forgets a ",dress,name,"I asked the woman at the party if she remembered me from last year, and she said she never forgets a name.",<VisionEgg.WrappedText.WrappedText object at 0x113bc4460>
222.0000,8.000,2,2,2,joke,"She went on a fourteen day diet, but she only lost two",weeks,ounces,"She went on a fourteen day diet, but she only lost two weeks.",<VisionEgg.WrappedText.WrappedText object at 0x113bc4410>
230.0000,4.000,fix
234.0000,8.000,2,12,2,joke,In some marriages the bride is given away by the ,press,family ,In some marriages the bride is given away by the press.,<VisionEgg.WrappedText.WrappedText object at 0x113bc44b0>
242.0000,2.000,fix
244.0000,8.000,2,45,2,nonjoke,"She is so modest, she pulls down the shade to change her", mind,jacket,"She is so modest, she pulls down the shade to change her jacket.",<VisionEgg.WrappedText.WrappedText object at 0x113bc4500>
252.0000,6.000,fix
258.0000,8.000,2,97,2,nonjoke,"When I found out how much my wife spent on dresses last year, I dumped her and proposed to the",dressmaker,mistress,"When I found out how much my wife spent on dresses last year, I dumped her and proposed to the mistress.",<VisionEgg.WrappedText.WrappedText object at 0x113bc4550>
266.0000,2.000,fix
268.0000,8.000,2,77,2,nonjoke,He is at the age when all the numbers in his little black book belong to,doctors,friends,He is at the age when all the numbers in his little black book belong to friends.,<VisionEgg.WrappedText.WrappedText object at 0x113bc45a0>
276.0000,8.000,2,111,2,nonjoke,"Some husbands are good providers, but only if you count",children,salary,"Some husbands are good providers, but only if you count salary.",<VisionEgg.WrappedText.WrappedText object at 0x113bc4640>
284.0000,22.000,fix
306.0000,8.000,2,127,2,nonjoke,The penalty for dishonesty is the disgrace of dying,rich,unloved,The penalty for dishonesty is the disgrace of dying unloved.,<VisionEgg.WrappedText.WrappedText object at 0x113bc45f0>
314.0000,8.000,2,141,2,nonjoke,The only crop that is grown in America and harvested abroad is the American,tourist,tobacco,The only crop that is grown in America and harvested abroad is the American tobacco.,<VisionEgg.WrappedText.WrappedText object at 0x113bc4690>
322.0000,8.000,2,120,2,joke,Two things are essential for success: wealth and,money,fame,Two things are essential for success: wealth and money.,<VisionEgg.WrappedText.WrappedText object at 0x113bc4730>
330.0000,2.000,fix
332.0000,8.000,2,43,2,nonjoke,"I asked him if he started out as an editor, and he said that years ago he used to be a ",boy,journalist,"I asked him if he started out as an editor, and he said that years ago he used to be a journalist.",<VisionEgg.WrappedText.WrappedText object at 0x113bc46e0>
340.0000,10.000,fix
350.0000,8.000,2,125,2,nonjoke,I know one couple who got divorced and had to leave the house to the,attorney,daughter,I know one couple who got divorced and had to leave the house to the daughter.,<VisionEgg.WrappedText.WrappedText object at 0x113bc4780>
358.0000,6.000,fix
364.0000,8.000,2,22,2,joke,Our son brought home a note from school saying they need a written excuse for his,presence,tardiness,Our son brought home a note from school saying they need a written excuse for his presence.,<VisionEgg.WrappedText.WrappedText object at 0x113bc4820>
372.0000,8.000,2,29,2,nonjoke,My doctor has never violated his oath: the oath he took years ago to become a,millionaire,practitioner,My doctor has never violated his oath: the oath he took years ago to become a practitioner.,<VisionEgg.WrappedText.WrappedText object at 0x113bc47d0>
380.0000,6.000,fix
386.0000,8.000,2,69,2,nonjoke,"When an irresistible force meets an immovable object, you get two very angry",women,entities,"When an irresistible force meets an immovable object, you get two very angry entities.",<VisionEgg.WrappedText.WrappedText object at 0x113bc4870>
394.0000,4.000,fix
398.0000,8.000,2,28,2,joke,Her press agent was operated on for an ingrown,beeper,eyelash,Her press agent was operated on for an ingrown beeper.,<VisionEgg.WrappedText.WrappedText object at 0x113bc48c0>
406.0000,4.000,fix
410.0000,8.000,2,39,2,nonjoke,The best way to remove coffee stains from a white blouse is with,scissors,detergent,The best way to remove coffee stains from a white blouse is with detergent.,<VisionEgg.WrappedText.WrappedText object at 0x113bc4910>
418.0000,4.000,fix
422.0000,8.000,2,136,2,joke,The only fishing through the ice that some men ever do is for the ,olive,trout,The only fishing through the ice that some men ever do is for the olive.,<VisionEgg.WrappedText.WrappedText object at 0x113bc49b0>
430.0000,4.000,fix
434.0000,8.000,2,11,2,nonjoke,"He owns stock in a company that pays quarterly dividends, so every three months they send him a",quarter,statement,"He owns stock in a company that pays quarterly dividends, so every three months they send him a statement.",<VisionEgg.WrappedText.WrappedText object at 0x113bc4960>
442.0000,8.000,2,84,2,joke,"The convict told his cellmate how he'd blown all the money he stole on wine, women, and ",lawyers,crack,"The convict told his cellmate how he'd blown all the money he stole on wine, women, and lawyers.",<VisionEgg.WrappedText.WrappedText object at 0x113bc4a00>
450.0000,8.000,2,38,2,joke,This fall two things are turning yellow: trees and,investors,bushes,This fall two things are turning yellow: trees and investors.,<VisionEgg.WrappedText.WrappedText object at 0x113bc4a50>
458.0000,2.000,fix
460.0000,8.000,2,98,2,joke,"Nature has three ways of thinning the herd: drought, famine, and ",primaries,hunting,"Nature has three ways of thinning the herd: drought, famine, and primaries.",<VisionEgg.WrappedText.WrappedText object at 0x113bc4aa0>
468.0000,8.000,2,119,2,nonjoke,"He told me he's not broke, just badly",bent,off,"He told me he's not broke, just badly off.",<VisionEgg.WrappedText.WrappedText object at 0x113bc4af0>
476.0000,2.000,fix
478.0000,8.000,2,70,2,joke,The best gift for the man who has everything is,penicillin,neckties,The best gift for the man who has everything is penicillin.,<VisionEgg.WrappedText.WrappedText object at 0x113bc4b90>
486.0000,22.000,fix
508.0000,8.000,2,54,2,joke,The tourist bureau told the visitors there was plenty of hunting in this part of the country but very little,finding,sightseeing,The tourist bureau told the visitors there was plenty of hunting in this part of the country but very little finding.,<VisionEgg.WrappedText.WrappedText object at 0x113bc4b40>
516.0000,8.000,2,112,2,joke,The art museum just acquired an early Rembrandt; it's done in ,Crayola,charcoal,The art museum just acquired an early Rembrandt; it's done in Crayola.,<VisionEgg.WrappedText.WrappedText object at 0x113bc4be0>
524.0000,2.000,fix
526.0000,8.000,2,66,2,joke,One good way to invest in the country is to buy a ,senator,business,One good way to invest in the country is to buy a senator.,<VisionEgg.WrappedText.WrappedText object at 0x113bc4c30>
534.0000,8.000,2,116,2,joke,Autobiography is an unrivaled vehicle for telling the truth about,others,somebody,Autobiography is an unrivaled vehicle for telling the truth about others.,<VisionEgg.WrappedText.WrappedText object at 0x113bc4c80>
542.0000,2.000,fix
544.0000,8.000,2,132,2,joke,The last time a guy in a mask took all my money I was in,surgery,shock,The last time a guy in a mask took all my money I was in surgery.,<VisionEgg.WrappedText.WrappedText object at 0x113bc4cd0>
552.0000,10.000,fix
562.0000,8.000,2,46,2,joke,Arguments between couples are healthy; sometimes they even prevent,marriage,breakups,Arguments between couples are healthy; sometimes they even prevent marriage.,<VisionEgg.WrappedText.WrappedText object at 0x113bc4d20>
FED_20170412c_3T2,2,131,2,nonjoke,"Statistics indicate that Americans spend eighty million a year on games of chance, mostly",weddings, blackjack,"Statistics indicate that Americans spend eighty million a year on games of chance, mostly blackjack.",1,0.7332549095153809,6.009068012237549
FED_20170412c_3T2,2,126,2,joke,My husband took the money we were saving to buy a new car and blew it all at the,laundry,tables,My husband took the money we were saving to buy a new car and blew it all at the laundry.,,,14.009954929351807
FED_20170412c_3T2,2,42,2,joke,The best way to keep the milk from turning sour is to keep it in the,cow,cold,The best way to keep the milk from turning sour is to keep it in the cow.,3,0.3666238784790039,24.011096000671387
FED_20170412c_3T2,2,31,2,nonjoke,"He told her he wasn't himself, and she said she'd noticed the",improvement,problem,"He told her he wasn't himself, and she said she'd noticed the problem.",1,1.183502197265625,32.01189184188843
FED_20170412c_3T2,2,100,2,joke,"I hope this train stops at Grand Central because if it doesn't, there will be a ",crash,delay,"I hope this train stops at Grand Central because if it doesn't, there will be a crash.",3,0.9501700401306152,40.01274800300598
FED_20170412c_3T2,2,15,2,nonjoke,"When John bought a bulldog, it was no time at all before he had that dog eating out of his",leg,fingers,"When John bought a bulldog, it was no time at all before he had that dog eating out of his fingers.",1,0.616814136505127,48.013548851013184
FED_20170412c_3T2,2,5,2,nonjoke,She read so much about the bad effects of cigarettes she decided to give up the,reading,habit,She read so much about the bad effects of cigarettes she decided to give up the habit.,1,0.6168248653411865,58.014703035354614
FED_20170412c_3T2,2,139,2,nonjoke,They redecorated the bar with new,drunks,wood,They redecorated the bar with new wood.,1,0.5500741004943848,68.01584887504578
FED_20170412c_3T2,2,72,2,joke,The first two hundred story building opened in Chicago; it was a ,library,hotel,The first two hundred story building opened in Chicago; it was a library.,3,1.5500609874725342,78.00039601325989
FED_20170412c_3T2,2,49,2,nonjoke,One person who sure makes a long story short is my,editor,aunt,One person who sure makes a long story short is my aunt.,3,0.9333720207214355,88.00150394439697
FED_20170412c_3T2,2,123,2,nonjoke,Too many girls believe that the chief foundation for true love is a large,stone,fortune,Too many girls believe that the chief foundation for true love is a large fortune.,1,0.8999991416931152,96.00228691101074
FED_20170412c_3T2,2,129,2,nonjoke,The perfect companion to a vegetarian dinner is a ,steak,salad,The perfect companion to a vegetarian dinner is a salad.,2,0.5165631771087646,106.00353288650513
FED_20170412c_3T2,2,146,2,joke,"Love has its benefits, and they are usually called",alimony,memories,"Love has its benefits, and they are usually called alimony.",,,114.00431704521179
FED_20170412c_3T2,2,113,2,nonjoke,Some people's only culture is,bacteria,radio,Some people's only culture is radio.,1,0.36672019958496094,128.00590586662292
FED_20170412c_3T2,2,17,2,nonjoke,A committee keeps minutes and takes,hours,votes,A committee keeps minutes and takes votes.,1,0.9167361259460449,144.00770783424377
FED_20170412c_3T2,2,14,2,joke,He got a medal for bravery on the beach when he rescued a girl from a ,lifeguard,shipwreck,He got a medal for bravery on the beach when he rescued a girl from a lifeguard.,2,0.5167949199676514,152.0084879398346
FED_20170412c_3T2,2,82,2,joke,"When it comes to keeping warm, nothing beats a thermal",brunette,parka,"When it comes to keeping warm, nothing beats a thermal brunette.",1,0.7000539302825928,160.00950002670288
FED_20170412c_3T2,2,155,2,nonjoke,The show had one act that was really offbeat: the,singer,clowns,The show had one act that was really offbeat: the clowns.,2,1.5001070499420166,174.01110291481018
FED_20170412c_3T2,2,148,2,joke,The best bargain I ever got was when I went to a family garage sale and bought a ,grandma,toaster,The best bargain I ever got was when I went to a family garage sale and bought a grandma.,3,1.700131893157959,182.0119559764862
FED_20170412c_3T2,2,6,2,joke,Sunday is the day we bow our heads and,putt,rest,Sunday is the day we bow our heads and putt.,1,0.6666660308837891,190.01283884048462
FED_20170412c_3T2,2,35,2,nonjoke,"Now that the Hollywood couple has ironed out the divorce settlement, they can finally go ahead with their",nuptials,careers,"Now that the Hollywood couple has ironed out the divorce settlement, they can finally go ahead with their careers.",1,1.700171947479248,200.01397895812988
FED_20170412c_3T2,2,124,2,joke,"I've got Parkinson's disease, and he's got", mine,gout,"I've got Parkinson's disease, and he's got mine.",3,0.6001040935516357,208.01488494873047
FED_20170412c_3T2,2,9,2,nonjoke,"I asked the woman at the party if she remembered me from last year, and she said she never forgets a ",dress,name,"I asked the woman at the party if she remembered me from last year, and she said she never forgets a name.",2,1.5000159740447998,220.01626896858215
FED_20170412c_3T2,2,2,2,joke,"She went on a fourteen day diet, but she only lost two",weeks,ounces,"She went on a fourteen day diet, but she only lost two weeks.",2,0.5000948905944824,228.0004539489746
FED_20170412c_3T2,2,12,2,joke,In some marriages the bride is given away by the ,press,family ,In some marriages the bride is given away by the press.,1,1.3833858966827393,240.00179600715637
FED_20170412c_3T2,2,45,2,nonjoke,"She is so modest, she pulls down the shade to change her", mind,jacket,"She is so modest, she pulls down the shade to change her jacket.",2,1.7667789459228516,250.0029580593109
FED_20170412c_3T2,2,97,2,nonjoke,"When I found out how much my wife spent on dresses last year, I dumped her and proposed to the",dressmaker,mistress,"When I found out how much my wife spent on dresses last year, I dumped her and proposed to the mistress.",1,0.4667179584503174,264.00443506240845
FED_20170412c_3T2,2,77,2,nonjoke,He is at the age when all the numbers in his little black book belong to,doctors,friends,He is at the age when all the numbers in his little black book belong to friends.,2,0.6167700290679932,274.0056688785553
FED_20170412c_3T2,2,111,2,nonjoke,"Some husbands are good providers, but only if you count",children,salary,"Some husbands are good providers, but only if you count salary.",1,0.9835019111633301,282.00658798217773
FED_20170412c_3T2,2,127,2,nonjoke,The penalty for dishonesty is the disgrace of dying,rich,unloved,The penalty for dishonesty is the disgrace of dying unloved.,,,312.00993299484253
FED_20170412c_3T2,2,141,2,nonjoke,The only crop that is grown in America and harvested abroad is the American,tourist,tobacco,The only crop that is grown in America and harvested abroad is the American tobacco.,1,2.3337268829345703,320.0109610557556
FED_20170412c_3T2,2,120,2,joke,Two things are essential for success: wealth and,money,fame,Two things are essential for success: wealth and money.,2,1.1167728900909424,328.01187205314636
FED_20170412c_3T2,2,43,2,nonjoke,"I asked him if he started out as an editor, and he said that years ago he used to be a ",boy,journalist,"I asked him if he started out as an editor, and he said that years ago he used to be a journalist.",1,1.666741132736206,338.02978587150574
FED_20170412c_3T2,2,125,2,nonjoke,I know one couple who got divorced and had to leave the house to the,attorney,daughter,I know one couple who got divorced and had to leave the house to the daughter.,1,0.6501128673553467,356.01503705978394
FED_20170412c_3T2,2,22,2,joke,Our son brought home a note from school saying they need a written excuse for his,presence,tardiness,Our son brought home a note from school saying they need a written excuse for his presence.,3,1.083400011062622,370.01665687561035
FED_20170412c_3T2,2,29,2,nonjoke,My doctor has never violated his oath: the oath he took years ago to become a,millionaire,practitioner,My doctor has never violated his oath: the oath he took years ago to become a practitioner.,3,0.5334610939025879,378.0008909702301
FED_20170412c_3T2,2,69,2,nonjoke,"When an irresistible force meets an immovable object, you get two very angry",women,entities,"When an irresistible force meets an immovable object, you get two very angry entities.",3,0.8667840957641602,392.00246596336365
FED_20170412c_3T2,2,28,2,joke,Her press agent was operated on for an ingrown,beeper,eyelash,Her press agent was operated on for an ingrown beeper.,,,404.0039539337158
FED_20170412c_3T2,2,39,2,nonjoke,The best way to remove coffee stains from a white blouse is with,scissors,detergent,The best way to remove coffee stains from a white blouse is with detergent.,1,0.5001039505004883,416.00523805618286
FED_20170412c_3T2,2,136,2,joke,The only fishing through the ice that some men ever do is for the ,olive,trout,The only fishing through the ice that some men ever do is for the olive.,2,1.9834058284759521,428.00664806365967
FED_20170412c_3T2,2,11,2,nonjoke,"He owns stock in a company that pays quarterly dividends, so every three months they send him a",quarter,statement,"He owns stock in a company that pays quarterly dividends, so every three months they send him a statement.",1,1.9001750946044922,440.0080678462982
FED_20170412c_3T2,2,84,2,joke,"The convict told his cellmate how he'd blown all the money he stole on wine, women, and ",lawyers,crack,"The convict told his cellmate how he'd blown all the money he stole on wine, women, and lawyers.",1,0.5500919818878174,448.00897097587585
FED_20170412c_3T2,2,38,2,joke,This fall two things are turning yellow: trees and,investors,bushes,This fall two things are turning yellow: trees and investors.,2,0.5500011444091797,456.0099198818207
FED_20170412c_3T2,2,98,2,joke,"Nature has three ways of thinning the herd: drought, famine, and ",primaries,hunting,"Nature has three ways of thinning the herd: drought, famine, and primaries.",2,1.1500968933105469,466.0110809803009
FED_20170412c_3T2,2,119,2,nonjoke,"He told me he's not broke, just badly",bent,off,"He told me he's not broke, just badly off.",2,1.4668750762939453,474.0119278430939
FED_20170412c_3T2,2,70,2,joke,The best gift for the man who has everything is,penicillin,neckties,The best gift for the man who has everything is penicillin.,2,0.5333559513092041,484.0130920410156
FED_20170412c_3T2,2,54,2,joke,The tourist bureau told the visitors there was plenty of hunting in this part of the country but very little,finding,sightseeing,The tourist bureau told the visitors there was plenty of hunting in this part of the country but very little finding.,2,1.1835050582885742,514.0166339874268
FED_20170412c_3T2,2,112,2,joke,The art museum just acquired an early Rembrandt; it's done in ,Crayola,charcoal,The art museum just acquired an early Rembrandt; it's done in Crayola.,3,0.35006117820739746,522.0008828639984
FED_20170412c_3T2,2,66,2,joke,One good way to invest in the country is to buy a ,senator,business,One good way to invest in the country is to buy a senator.,4,1.216677188873291,532.0020668506622
FED_20170412c_3T2,2,116,2,joke,Autobiography is an unrivaled vehicle for telling the truth about,others,somebody,Autobiography is an unrivaled vehicle for telling the truth about others.,3,0.9168570041656494,540.0028760433197
FED_20170412c_3T2,2,132,2,joke,The last time a guy in a mask took all my money I was in,surgery,shock,The last time a guy in a mask took all my money I was in surgery.,3,0.41674089431762695,550.0041739940643
FED_20170412c_3T2,2,46,2,joke,Arguments between couples are healthy; sometimes they even prevent,marriage,breakups,Arguments between couples are healthy; sometimes they even prevent marriage.,2,0.5333521366119385,568.006276845932
