subj,run,item,list,category,sentence,joke ending,nonjoke ending,displayed,response,RT,question onset
0.0000,8.000,1,30,1,nonjoke,Nothing you put in a banana split is as potentially fattening as the,spoon,syrup,Nothing you put in a banana split is as potentially fattening as the syrup.,<VisionEgg.WrappedText.WrappedText object at 0x107403f50>
8.0000,2.000,fix
10.0000,8.000,1,86,1,nonjoke,"I asked the florist what I should give to my girlfriend, and he suggested his",address,tulips,"I asked the florist what I should give to my girlfriend, and he suggested his tulips.",<VisionEgg.WrappedText.WrappedText object at 0x107403e10>
18.0000,8.000,1,23,1,joke,The curse of heavy drinking is that afterwards you get a huge,bar tab,headache,The curse of heavy drinking is that afterwards you get a huge bar tab.,<VisionEgg.WrappedText.WrappedText object at 0x107403f00>
26.0000,2.000,fix
28.0000,8.000,1,72,1,nonjoke,The first two hundred story building opened in Chicago; it was a ,library,hotel,The first two hundred story building opened in Chicago; it was a hotel.,<VisionEgg.WrappedText.WrappedText object at 0x107403dc0>
36.0000,2.000,fix
38.0000,8.000,1,39,1,joke,The best way to remove coffee stains from a white blouse is with,scissors,detergent,The best way to remove coffee stains from a white blouse is with scissors.,<VisionEgg.WrappedText.WrappedText object at 0x107403af0>
46.0000,2.000,fix
48.0000,8.000,1,110,1,nonjoke,It's not hard to meet expenses; they're ,everywhere,affordable,It's not hard to meet expenses; they're affordable.,<VisionEgg.WrappedText.WrappedText object at 0x107403c30>
56.0000,2.000,fix
58.0000,8.000,1,64,1,nonjoke,The best way to stop an elephant from charging is to cut off its,credit,toes,The best way to stop an elephant from charging is to cut off its toes.,<VisionEgg.WrappedText.WrappedText object at 0x107403d20>
66.0000,8.000,1,147,1,joke,"When we got divorced, my wife and I split the house; she got the",inside,kitchen,"When we got divorced, my wife and I split the house; she got the inside.",<VisionEgg.WrappedText.WrappedText object at 0x107403c80>
74.0000,14.000,fix
88.0000,8.000,1,135,1,joke,"My mechanic couldn't fix my brakes, so he fixed my",horn,clutch,"My mechanic couldn't fix my brakes, so he fixed my horn.",<VisionEgg.WrappedText.WrappedText object at 0x107403a00>
96.0000,2.000,fix
98.0000,8.000,1,16,1,nonjoke,Many a man's idea of a vacation is to rest quietly in the shade of a ,blonde,palm,Many a man's idea of a vacation is to rest quietly in the shade of a palm.,<VisionEgg.WrappedText.WrappedText object at 0x107403a50>
106.0000,2.000,fix
108.0000,8.000,1,104,1,nonjoke,Politicians who are as American as apple pie still want their,slice,rewards,Politicians who are as American as apple pie still want their rewards.,<VisionEgg.WrappedText.WrappedText object at 0x107403cd0>
116.0000,8.000,1,74,1,nonjoke,He's planning an extended vacation; he hopes to spend three weeks on his,couch,sailboat,He's planning an extended vacation; he hopes to spend three weeks on his sailboat.,<VisionEgg.WrappedText.WrappedText object at 0x107403b90>
124.0000,12.000,fix
136.0000,8.000,1,31,1,joke,"He told her he wasn't himself, and she said she'd noticed the",improvement,problem,"He told her he wasn't himself, and she said she'd noticed the improvement.",<VisionEgg.WrappedText.WrappedText object at 0x107403aa0>
144.0000,6.000,fix
150.0000,8.000,1,153,1,joke,The husband who catches his wife in the act is probably on the,trapeze,snoop,The husband who catches his wife in the act is probably on the trapeze.,<VisionEgg.WrappedText.WrappedText object at 0x107403b40>
158.0000,4.000,fix
162.0000,8.000,1,83,1,joke,Nothing ages a woman faster than,identification,hardship,Nothing ages a woman faster than identification.,<VisionEgg.WrappedText.WrappedText object at 0x107403be0>
170.0000,4.000,fix
174.0000,8.000,1,11,1,joke,"He owns stock in a company that pays quarterly dividends, so every three months they send him a",quarter,statement,"He owns stock in a company that pays quarterly dividends, so every three months they send him a quarter.",<VisionEgg.WrappedText.WrappedText object at 0x10e9e8050>
182.0000,2.000,fix
184.0000,8.000,1,63,1,joke,"It's hard to raise a family nowadays, especially in the ",morning,country,"It's hard to raise a family nowadays, especially in the morning.",<VisionEgg.WrappedText.WrappedText object at 0x10e9e80a0>
192.0000,8.000,1,52,1,nonjoke,My wife did natural childbirth: no,makeup,anesthetic,My wife did natural childbirth: no anesthetic.,<VisionEgg.WrappedText.WrappedText object at 0x10e9e80f0>
200.0000,8.000,1,97,1,joke,"When I found out how much my wife spent on dresses last year, I dumped her and proposed to the",dressmaker,mistress,"When I found out how much my wife spent on dresses last year, I dumped her and proposed to the dressmaker.",<VisionEgg.WrappedText.WrappedText object at 0x10e9e8140>
208.0000,4.000,fix
212.0000,8.000,1,46,1,nonjoke,Arguments between couples are healthy; sometimes they even prevent,marriage,breakups,Arguments between couples are healthy; sometimes they even prevent breakups.,<VisionEgg.WrappedText.WrappedText object at 0x10e9e8190>
220.0000,6.000,fix
226.0000,8.000,1,20,1,nonjoke,"He told me he just bought a set of balloon tires, and I told him I didn't even know he owned a",balloon,truck,"He told me he just bought a set of balloon tires, and I told him I didn't even know he owned a truck.",<VisionEgg.WrappedText.WrappedText object at 0x10e9e8230>
234.0000,8.000,1,18,1,nonjoke,"When we watch a sexy movie, my wife leans over and breathes on my",glasses,collar,"When we watch a sexy movie, my wife leans over and breathes on my collar.",<VisionEgg.WrappedText.WrappedText object at 0x10e9e81e0>
242.0000,8.000,1,89,1,joke,"Some babies are born to rule, while others are",male,weak,"Some babies are born to rule, while others are male.",<VisionEgg.WrappedText.WrappedText object at 0x10e9e8280>
250.0000,8.000,1,75,1,joke,"When reviewing your notes for a test, the most important ones will be",illegible,capitalized,"When reviewing your notes for a test, the most important ones will be illegible.",<VisionEgg.WrappedText.WrappedText object at 0x10e9e82d0>
258.0000,12.000,fix
270.0000,8.000,1,58,1,nonjoke,The woman who has her husband eating out of her hand must save a lot of,dishwashing,heartbreak,The woman who has her husband eating out of her hand must save a lot of heartbreak.,<VisionEgg.WrappedText.WrappedText object at 0x10e9e8320>
278.0000,8.000,1,105,1,joke,The book that tells you where you can go on vacation is called a,checkbook,guidebook,The book that tells you where you can go on vacation is called a checkbook.,<VisionEgg.WrappedText.WrappedText object at 0x10e9e83c0>
286.0000,2.000,fix
288.0000,8.000,1,117,1,joke,"All roads lead to Rome, and all detours lead to",profanity,somewhere,"All roads lead to Rome, and all detours lead to profanity.",<VisionEgg.WrappedText.WrappedText object at 0x10e9e8370>
296.0000,14.000,fix
310.0000,8.000,1,66,1,nonjoke,One good way to invest in the country is to buy a ,senator,business,One good way to invest in the country is to buy a business.,<VisionEgg.WrappedText.WrappedText object at 0x10e9e8410>
318.0000,4.000,fix
322.0000,8.000,1,61,1,joke,"For great vacation, put the kids in the back seat, and take a ",cruise,freeway,"For great vacation, put the kids in the back seat, and take a cruise.",<VisionEgg.WrappedText.WrappedText object at 0x10e9e8460>
330.0000,2.000,fix
332.0000,8.000,1,44,1,nonjoke,The only place where you can find people who spend all their time minding their own business is the ,cemetery,bank,The only place where you can find people who spend all their time minding their own business is the bank.,<VisionEgg.WrappedText.WrappedText object at 0x10e9e84b0>
340.0000,2.000,fix
342.0000,8.000,1,1,1,joke,"When I asked how long he should cook the noodles, I said at least ten",inches,seconds,"When I asked how long he should cook the noodles, I said at least ten inches.",<VisionEgg.WrappedText.WrappedText object at 0x10e9e8500>
350.0000,4.000,fix
354.0000,8.000,1,12,1,nonjoke,In some marriages the bride is given away by the ,press,family ,In some marriages the bride is given away by the family .,<VisionEgg.WrappedText.WrappedText object at 0x10e9e8550>
362.0000,2.000,fix
364.0000,8.000,1,87,1,joke,"It's always nicer to give than to receive, especially when its your",opinion,parents,"It's always nicer to give than to receive, especially when its your opinion.",<VisionEgg.WrappedText.WrappedText object at 0x10e9e85a0>
372.0000,2.000,fix
374.0000,8.000,1,93,1,joke,"He is probably the best boxer in the country, but he always loses in the ",city,competition,"He is probably the best boxer in the country, but he always loses in the city.",<VisionEgg.WrappedText.WrappedText object at 0x10e9e85f0>
382.0000,4.000,fix
386.0000,8.000,1,59,1,joke,"Women don't dress to please men; if they did, they'd dress a lot",faster,scantier,"Women don't dress to please men; if they did, they'd dress a lot faster.",<VisionEgg.WrappedText.WrappedText object at 0x10e9e8640>
394.0000,8.000,1,41,1,joke,His doctor recommended he stay flat on his back ever since he was hit by a ,steamroller,motorist,His doctor recommended he stay flat on his back ever since he was hit by a steamroller.,<VisionEgg.WrappedText.WrappedText object at 0x10e9e8690>
402.0000,8.000,1,2,1,nonjoke,"She went on a fourteen day diet, but she only lost two",weeks,ounces,"She went on a fourteen day diet, but she only lost two ounces.",<VisionEgg.WrappedText.WrappedText object at 0x10e9e86e0>
410.0000,8.000,fix
418.0000,8.000,1,26,1,nonjoke,"To clothe one soldier, it takes the wool from two sheep and the hides from three",taxpayers,animals,"To clothe one soldier, it takes the wool from two sheep and the hides from three animals.",<VisionEgg.WrappedText.WrappedText object at 0x10e9e8730>
426.0000,6.000,fix
432.0000,8.000,1,80,1,nonjoke,He says he doesn't like to drink because it makes him feel,happy,sad,He says he doesn't like to drink because it makes him feel sad.,<VisionEgg.WrappedText.WrappedText object at 0x10e9e8780>
440.0000,4.000,fix
444.0000,8.000,1,137,1,joke,A man who has lost ninety percent of his brain is called a,widower,zombie,A man who has lost ninety percent of his brain is called a widower.,<VisionEgg.WrappedText.WrappedText object at 0x10e9e87d0>
452.0000,8.000,1,152,1,nonjoke,"Many things run in families, especially",noses,strength,"Many things run in families, especially strength.",<VisionEgg.WrappedText.WrappedText object at 0x10e9e8820>
460.0000,8.000,1,51,1,joke,I went to a place that serves breakfast any time and ordered French toast in the,Renaissance,nighttime,I went to a place that serves breakfast any time and ordered French toast in the Renaissance.,<VisionEgg.WrappedText.WrappedText object at 0x10e9e8870>
468.0000,8.000,1,150,1,nonjoke,One way to keep pornography away from teenagers is to put it in a,textbook,cabinet,One way to keep pornography away from teenagers is to put it in a cabinet.,<VisionEgg.WrappedText.WrappedText object at 0x10e9e88c0>
476.0000,2.000,fix
478.0000,8.000,1,10,1,nonjoke,Nothing in the known universe travels faster than,gossip,radiation,Nothing in the known universe travels faster than radiation.,<VisionEgg.WrappedText.WrappedText object at 0x10e9e8960>
486.0000,8.000,1,103,1,joke,"I still miss my ex-wife, but I am improving my",aim,ego,"I still miss my ex-wife, but I am improving my aim.",<VisionEgg.WrappedText.WrappedText object at 0x10e9e8910>
494.0000,4.000,fix
498.0000,8.000,1,29,1,joke,My doctor has never violated his oath: the oath he took years ago to become a,millionaire,practitioner,My doctor has never violated his oath: the oath he took years ago to become a millionaire.,<VisionEgg.WrappedText.WrappedText object at 0x10e9e89b0>
506.0000,8.000,1,120,1,nonjoke,Two things are essential for success: wealth and,money,fame,Two things are essential for success: wealth and fame.,<VisionEgg.WrappedText.WrappedText object at 0x10e9e8a00>
514.0000,2.000,fix
516.0000,8.000,1,154,1,nonjoke,"This new computer works so quickly, it comes complete with",ulcers,games,"This new computer works so quickly, it comes complete with games.",<VisionEgg.WrappedText.WrappedText object at 0x10e9e8a50>
524.0000,2.000,fix
526.0000,8.000,1,138,1,nonjoke,Modern science is amazing: garbage is now being made into,movies,gasoline,Modern science is amazing: garbage is now being made into gasoline.,<VisionEgg.WrappedText.WrappedText object at 0x10e9e8aa0>
534.0000,8.000,1,84,1,nonjoke,"The convict told his cellmate how he'd blown all the money he stole on wine, women, and ",lawyers,crack,"The convict told his cellmate how he'd blown all the money he stole on wine, women, and crack.",<VisionEgg.WrappedText.WrappedText object at 0x10e9e8af0>
542.0000,2.000,fix
544.0000,8.000,1,73,1,joke,One thing that makes the world go round is,detours,greed,One thing that makes the world go round is detours.,<VisionEgg.WrappedText.WrappedText object at 0x10e9e8b40>
552.0000,2.000,fix
554.0000,8.000,1,67,1,joke,The most prevalent form of legalized gambling is,elections,betting,The most prevalent form of legalized gambling is elections.,<VisionEgg.WrappedText.WrappedText object at 0x10e9e8b90>
562.0000,8.000,fix
FED_20170426c_3T2,1,30,1,nonjoke,Nothing you put in a banana split is as potentially fattening as the,spoon,syrup,Nothing you put in a banana split is as potentially fattening as the syrup.,,,6.0094640254974365
FED_20170426c_3T2,1,86,1,nonjoke,"I asked the florist what I should give to my girlfriend, and he suggested his",address,tulips,"I asked the florist what I should give to my girlfriend, and he suggested his tulips.",2,1.8669002056121826,16.010720014572144
FED_20170426c_3T2,1,23,1,joke,The curse of heavy drinking is that afterwards you get a huge,bar tab,headache,The curse of heavy drinking is that afterwards you get a huge bar tab.,3,1.5001518726348877,24.011747121810913
FED_20170426c_3T2,1,72,1,nonjoke,The first two hundred story building opened in Chicago; it was a ,library,hotel,The first two hundred story building opened in Chicago; it was a hotel.,1,1.0500929355621338,34.01299810409546
FED_20170426c_3T2,1,39,1,joke,The best way to remove coffee stains from a white blouse is with,scissors,detergent,The best way to remove coffee stains from a white blouse is with scissors.,3,1.2668640613555908,44.014193058013916
FED_20170426c_3T2,1,110,1,nonjoke,It's not hard to meet expenses; they're ,everywhere,affordable,It's not hard to meet expenses; they're affordable.,2,1.4002139568328857,54.015456199645996
FED_20170426c_3T2,1,64,1,nonjoke,The best way to stop an elephant from charging is to cut off its,credit,toes,The best way to stop an elephant from charging is to cut off its toes.,3,0.7167789936065674,64.01671314239502
FED_20170426c_3T2,1,147,1,joke,"When we got divorced, my wife and I split the house; she got the",inside,kitchen,"When we got divorced, my wife and I split the house; she got the inside.",3,1.3501288890838623,72.00105810165405
FED_20170426c_3T2,1,135,1,joke,"My mechanic couldn't fix my brakes, so he fixed my",horn,clutch,"My mechanic couldn't fix my brakes, so he fixed my horn.",2,1.483572006225586,94.00376415252686
FED_20170426c_3T2,1,16,1,nonjoke,Many a man's idea of a vacation is to rest quietly in the shade of a ,blonde,palm,Many a man's idea of a vacation is to rest quietly in the shade of a palm.,1,1.1335351467132568,104.00502705574036
FED_20170426c_3T2,1,104,1,nonjoke,Politicians who are as American as apple pie still want their,slice,rewards,Politicians who are as American as apple pie still want their rewards.,1,1.2667980194091797,114.00628805160522
FED_20170426c_3T2,1,74,1,nonjoke,He's planning an extended vacation; he hopes to spend three weeks on his,couch,sailboat,He's planning an extended vacation; he hopes to spend three weeks on his sailboat.,1,1.3001291751861572,122.00730204582214
FED_20170426c_3T2,1,31,1,joke,"He told her he wasn't himself, and she said she'd noticed the",improvement,problem,"He told her he wasn't himself, and she said she'd noticed the improvement.",3,1.033423900604248,142.00975608825684
FED_20170426c_3T2,1,153,1,joke,The husband who catches his wife in the act is probably on the,trapeze,snoop,The husband who catches his wife in the act is probably on the trapeze.,2,1.5501840114593506,156.0115191936493
FED_20170426c_3T2,1,83,1,joke,Nothing ages a woman faster than,identification,hardship,Nothing ages a woman faster than identification.,3,1.5335078239440918,168.0130431652069
FED_20170426c_3T2,1,11,1,joke,"He owns stock in a company that pays quarterly dividends, so every three months they send him a",quarter,statement,"He owns stock in a company that pays quarterly dividends, so every three months they send him a quarter.",2,0.9500789642333984,180.0145561695099
FED_20170426c_3T2,1,63,1,joke,"It's hard to raise a family nowadays, especially in the ",morning,country,"It's hard to raise a family nowadays, especially in the morning.",2,1.1168420314788818,190.01575112342834
FED_20170426c_3T2,1,52,1,nonjoke,My wife did natural childbirth: no,makeup,anesthetic,My wife did natural childbirth: no anesthetic.,1,1.2168629169464111,198.0167601108551
FED_20170426c_3T2,1,97,1,joke,"When I found out how much my wife spent on dresses last year, I dumped her and proposed to the",dressmaker,mistress,"When I found out how much my wife spent on dresses last year, I dumped her and proposed to the dressmaker.",3,1.1168551445007324,206.00109601020813
FED_20170426c_3T2,1,46,1,nonjoke,Arguments between couples are healthy; sometimes they even prevent,marriage,breakups,Arguments between couples are healthy; sometimes they even prevent breakups.,1,1.116814136505127,218.00261402130127
FED_20170426c_3T2,1,20,1,nonjoke,"He told me he just bought a set of balloon tires, and I told him I didn't even know he owned a",balloon,truck,"He told me he just bought a set of balloon tires, and I told him I didn't even know he owned a truck.",1,1.2501368522644043,232.00438117980957
FED_20170426c_3T2,1,18,1,nonjoke,"When we watch a sexy movie, my wife leans over and breathes on my",glasses,collar,"When we watch a sexy movie, my wife leans over and breathes on my collar.",1,1.600273847579956,240.0053071975708
FED_20170426c_3T2,1,89,1,joke,"Some babies are born to rule, while others are",male,weak,"Some babies are born to rule, while others are male.",4,1.066838026046753,248.00633215904236
FED_20170426c_3T2,1,75,1,joke,"When reviewing your notes for a test, the most important ones will be",illegible,capitalized,"When reviewing your notes for a test, the most important ones will be illegible.",4,0.4500601291656494,256.00734305381775
FED_20170426c_3T2,1,58,1,nonjoke,The woman who has her husband eating out of her hand must save a lot of,dishwashing,heartbreak,The woman who has her husband eating out of her hand must save a lot of heartbreak.,,,276.009868144989
FED_20170426c_3T2,1,105,1,joke,The book that tells you where you can go on vacation is called a,checkbook,guidebook,The book that tells you where you can go on vacation is called a checkbook.,3,1.1168429851531982,284.0108070373535
FED_20170426c_3T2,1,117,1,joke,"All roads lead to Rome, and all detours lead to",profanity,somewhere,"All roads lead to Rome, and all detours lead to profanity.",2,1.1335139274597168,294.0120761394501
FED_20170426c_3T2,1,66,1,nonjoke,One good way to invest in the country is to buy a ,senator,business,One good way to invest in the country is to buy a business.,1,1.3668031692504883,316.01485800743103
FED_20170426c_3T2,1,61,1,joke,"For great vacation, put the kids in the back seat, and take a ",cruise,freeway,"For great vacation, put the kids in the back seat, and take a cruise.",2,1.1501262187957764,328.0163559913635
FED_20170426c_3T2,1,44,1,nonjoke,The only place where you can find people who spend all their time minding their own business is the ,cemetery,bank,The only place where you can find people who spend all their time minding their own business is the bank.,3,1.6002368927001953,338.00089621543884
FED_20170426c_3T2,1,1,1,joke,"When I asked how long he should cook the noodles, I said at least ten",inches,seconds,"When I asked how long he should cook the noodles, I said at least ten inches.",1,1.4168310165405273,348.002149105072
FED_20170426c_3T2,1,12,1,nonjoke,In some marriages the bride is given away by the ,press,family ,In some marriages the bride is given away by the family .,1,1.933577060699463,360.0036690235138
FED_20170426c_3T2,1,87,1,joke,"It's always nicer to give than to receive, especially when its your",opinion,parents,"It's always nicer to give than to receive, especially when its your opinion.",3,0.783379077911377,370.00493001937866
FED_20170426c_3T2,1,93,1,joke,"He is probably the best boxer in the country, but he always loses in the ",city,competition,"He is probably the best boxer in the country, but he always loses in the city.",3,1.6836190223693848,380.00611114501953
FED_20170426c_3T2,1,59,1,joke,"Women don't dress to please men; if they did, they'd dress a lot",faster,scantier,"Women don't dress to please men; if they did, they'd dress a lot faster.",3,1.1835439205169678,392.00763511657715
FED_20170426c_3T2,1,41,1,joke,His doctor recommended he stay flat on his back ever since he was hit by a ,steamroller,motorist,His doctor recommended he stay flat on his back ever since he was hit by a steamroller.,2,1.416821002960205,400.00864720344543
FED_20170426c_3T2,1,2,1,nonjoke,"She went on a fourteen day diet, but she only lost two",weeks,ounces,"She went on a fourteen day diet, but she only lost two ounces.",1,1.0167570114135742,408.00965905189514
FED_20170426c_3T2,1,26,1,nonjoke,"To clothe one soldier, it takes the wool from two sheep and the hides from three",taxpayers,animals,"To clothe one soldier, it takes the wool from two sheep and the hides from three animals.",1,1.0667688846588135,424.0116801261902
FED_20170426c_3T2,1,80,1,nonjoke,He says he doesn't like to drink because it makes him feel,happy,sad,He says he doesn't like to drink because it makes him feel sad.,1,0.9668209552764893,438.01337909698486
FED_20170426c_3T2,1,137,1,joke,A man who has lost ninety percent of his brain is called a,widower,zombie,A man who has lost ninety percent of his brain is called a widower.,3,1.283458948135376,450.01490116119385
FED_20170426c_3T2,1,152,1,nonjoke,"Many things run in families, especially",noses,strength,"Many things run in families, especially strength.",1,0.9667141437530518,458.0159020423889
FED_20170426c_3T2,1,51,1,joke,I went to a place that serves breakfast any time and ordered French toast in the,Renaissance,nighttime,I went to a place that serves breakfast any time and ordered French toast in the Renaissance.,3,0.8167388439178467,466.0002372264862
FED_20170426c_3T2,1,150,1,nonjoke,One way to keep pornography away from teenagers is to put it in a,textbook,cabinet,One way to keep pornography away from teenagers is to put it in a cabinet.,1,1.2335431575775146,474.00117802619934
FED_20170426c_3T2,1,10,1,nonjoke,Nothing in the known universe travels faster than,gossip,radiation,Nothing in the known universe travels faster than radiation.,1,1.4835879802703857,484.00244402885437
FED_20170426c_3T2,1,103,1,joke,"I still miss my ex-wife, but I am improving my",aim,ego,"I still miss my ex-wife, but I am improving my aim.",2,0.9668178558349609,492.003454208374
FED_20170426c_3T2,1,29,1,joke,My doctor has never violated his oath: the oath he took years ago to become a,millionaire,practitioner,My doctor has never violated his oath: the oath he took years ago to become a millionaire.,1,1.633498191833496,504.0049660205841
FED_20170426c_3T2,1,120,1,nonjoke,Two things are essential for success: wealth and,money,fame,Two things are essential for success: wealth and fame.,1,1.7167448997497559,512.0060741901398
FED_20170426c_3T2,1,154,1,nonjoke,"This new computer works so quickly, it comes complete with",ulcers,games,"This new computer works so quickly, it comes complete with games.",1,1.58359694480896,522.0071680545807
FED_20170426c_3T2,1,138,1,nonjoke,Modern science is amazing: garbage is now being made into,movies,gasoline,Modern science is amazing: garbage is now being made into gasoline.,1,1.0668320655822754,532.0084381103516
FED_20170426c_3T2,1,84,1,nonjoke,"The convict told his cellmate how he'd blown all the money he stole on wine, women, and ",lawyers,crack,"The convict told his cellmate how he'd blown all the money he stole on wine, women, and crack.",1,0.7667980194091797,540.0094530582428
FED_20170426c_3T2,1,73,1,joke,One thing that makes the world go round is,detours,greed,One thing that makes the world go round is detours.,2,1.2167799472808838,550.0107131004333
FED_20170426c_3T2,1,67,1,joke,The most prevalent form of legalized gambling is,elections,betting,The most prevalent form of legalized gambling is elections.,1,1.966912031173706,560.0119760036469
