subj,run,item,list,category,sentence,joke ending,nonjoke ending,displayed,response,RT,question onset
0.0000,8.000,1,93,2,nonjoke,"He is probably the best boxer in the country, but he always loses in the ",city,competition,"He is probably the best boxer in the country, but he always loses in the competition.",<VisionEgg.WrappedText.WrappedText object at 0x107fb5af0>
8.0000,8.000,1,100,2,joke,"I hope this train stops at Grand Central because if it doesn't, there will be a ",crash,delay,"I hope this train stops at Grand Central because if it doesn't, there will be a crash.",<VisionEgg.WrappedText.WrappedText object at 0x107fb57d0>
16.0000,2.000,fix
18.0000,8.000,1,130,2,joke,"This house comes with lots of extras, mostly",termites,upgrades,"This house comes with lots of extras, mostly termites.",<VisionEgg.WrappedText.WrappedText object at 0x107fb5640>
26.0000,8.000,1,121,2,nonjoke,"Diamonds are produced by great pressure, usually provided by a ",girlfriend,piston,"Diamonds are produced by great pressure, usually provided by a piston.",<VisionEgg.WrappedText.WrappedText object at 0x107fb5690>
34.0000,8.000,1,78,2,joke,My brother-in-law enjoys fixing things around the house so much he spent an hour last night just fixing our,drinks,stove,My brother-in-law enjoys fixing things around the house so much he spent an hour last night just fixing our drinks.,<VisionEgg.WrappedText.WrappedText object at 0x107fb5500>
42.0000,8.000,1,39,2,nonjoke,The best way to remove coffee stains from a white blouse is with,scissors,detergent,The best way to remove coffee stains from a white blouse is with detergent.,<VisionEgg.WrappedText.WrappedText object at 0x107fb5b40>
50.0000,2.000,fix
52.0000,8.000,1,137,2,nonjoke,A man who has lost ninety percent of his brain is called a,widower,zombie,A man who has lost ninety percent of his brain is called a zombie.,<VisionEgg.WrappedText.WrappedText object at 0x107fb5b90>
60.0000,2.000,fix
62.0000,8.000,1,37,2,nonjoke,"The cops claimed that the prisoner just decided to come clean, but most people think he was forced into the",bathtub,admission,"The cops claimed that the prisoner just decided to come clean, but most people think he was forced into the admission.",<VisionEgg.WrappedText.WrappedText object at 0x107fb5c80>
70.0000,2.000,fix
72.0000,8.000,1,82,2,joke,"When it comes to keeping warm, nothing beats a thermal",brunette,parka,"When it comes to keeping warm, nothing beats a thermal brunette.",<VisionEgg.WrappedText.WrappedText object at 0x107fb5dc0>
80.0000,2.000,fix
82.0000,8.000,1,143,2,nonjoke,Most of the people running for office are not politicians; they're,commuters,candidates,Most of the people running for office are not politicians; they're candidates.,<VisionEgg.WrappedText.WrappedText object at 0x107fb5e60>
90.0000,8.000,1,135,2,nonjoke,"My mechanic couldn't fix my brakes, so he fixed my",horn,clutch,"My mechanic couldn't fix my brakes, so he fixed my clutch.",<VisionEgg.WrappedText.WrappedText object at 0x107fb5f50>
98.0000,2.000,fix
100.0000,8.000,1,149,2,nonjoke,"She asked what state he was born in, and he said in the ",nude,East,"She asked what state he was born in, and he said in the East.",<VisionEgg.WrappedText.WrappedText object at 0x107fd9050>
108.0000,8.000,1,98,2,joke,"Nature has three ways of thinning the herd: drought, famine, and ",primaries,hunting,"Nature has three ways of thinning the herd: drought, famine, and primaries.",<VisionEgg.WrappedText.WrappedText object at 0x107fd90f0>
116.0000,6.000,fix
122.0000,8.000,1,29,2,nonjoke,My doctor has never violated his oath: the oath he took years ago to become a,millionaire,practitioner,My doctor has never violated his oath: the oath he took years ago to become a practitioner.,<VisionEgg.WrappedText.WrappedText object at 0x107fd91e0>
130.0000,8.000,fix
138.0000,8.000,1,97,2,nonjoke,"When I found out how much my wife spent on dresses last year, I dumped her and proposed to the",dressmaker,mistress,"When I found out how much my wife spent on dresses last year, I dumped her and proposed to the mistress.",<VisionEgg.WrappedText.WrappedText object at 0x107fd9230>
146.0000,8.000,1,88,2,joke,The wind was so strong it blew out three,fuses,streetlights,The wind was so strong it blew out three fuses.,<VisionEgg.WrappedText.WrappedText object at 0x107fd9320>
154.0000,8.000,1,150,2,joke,One way to keep pornography away from teenagers is to put it in a,textbook,cabinet,One way to keep pornography away from teenagers is to put it in a textbook.,<VisionEgg.WrappedText.WrappedText object at 0x107fd93c0>
162.0000,6.000,fix
168.0000,8.000,1,69,2,nonjoke,"When an irresistible force meets an immovable object, you get two very angry",women,entities,"When an irresistible force meets an immovable object, you get two very angry entities.",<VisionEgg.WrappedText.WrappedText object at 0x107fd9410>
176.0000,8.000,1,12,2,joke,In some marriages the bride is given away by the ,press,family ,In some marriages the bride is given away by the press.,<VisionEgg.WrappedText.WrappedText object at 0x107fd9550>
184.0000,8.000,1,28,2,joke,Her press agent was operated on for an ingrown,beeper,eyelash,Her press agent was operated on for an ingrown beeper.,<VisionEgg.WrappedText.WrappedText object at 0x107fd95f0>
192.0000,2.000,fix
194.0000,8.000,1,107,2,nonjoke,The difference between a good speaker and a bad one is often a nice,nap,diction,The difference between a good speaker and a bad one is often a nice diction.,<VisionEgg.WrappedText.WrappedText object at 0x107fd9690>
202.0000,8.000,1,16,2,joke,Many a man's idea of a vacation is to rest quietly in the shade of a ,blonde,palm,Many a man's idea of a vacation is to rest quietly in the shade of a blonde.,<VisionEgg.WrappedText.WrappedText object at 0x107fd9780>
210.0000,4.000,fix
214.0000,8.000,1,1,2,nonjoke,"When I asked how long he should cook the noodles, I said at least ten",inches,seconds,"When I asked how long he should cook the noodles, I said at least ten seconds.",<VisionEgg.WrappedText.WrappedText object at 0x107fd97d0>
222.0000,8.000,1,126,2,joke,My husband took the money we were saving to buy a new car and blew it all at the,laundry,tables,My husband took the money we were saving to buy a new car and blew it all at the laundry.,<VisionEgg.WrappedText.WrappedText object at 0x107fd9910>
230.0000,4.000,fix
234.0000,8.000,1,138,2,joke,Modern science is amazing: garbage is now being made into,movies,gasoline,Modern science is amazing: garbage is now being made into movies.,<VisionEgg.WrappedText.WrappedText object at 0x107fd99b0>
242.0000,2.000,fix
244.0000,8.000,1,139,2,nonjoke,They redecorated the bar with new,drunks,wood,They redecorated the bar with new wood.,<VisionEgg.WrappedText.WrappedText object at 0x107fd9a50>
252.0000,6.000,fix
258.0000,8.000,1,51,2,nonjoke,I went to a place that serves breakfast any time and ordered French toast in the,Renaissance,nighttime,I went to a place that serves breakfast any time and ordered French toast in the nighttime.,<VisionEgg.WrappedText.WrappedText object at 0x107fd9aa0>
266.0000,2.000,fix
268.0000,8.000,1,55,2,nonjoke,His wife sued for divorce and asked for custody of the,cash,cat,His wife sued for divorce and asked for custody of the cat.,<VisionEgg.WrappedText.WrappedText object at 0x107fd9be0>
276.0000,8.000,1,127,2,nonjoke,The penalty for dishonesty is the disgrace of dying,rich,unloved,The penalty for dishonesty is the disgrace of dying unloved.,<VisionEgg.WrappedText.WrappedText object at 0x107fd9c80>
284.0000,22.000,fix
306.0000,8.000,1,7,2,nonjoke,A replacement player hit a home run with my,girl,ball,A replacement player hit a home run with my ball.,<VisionEgg.WrappedText.WrappedText object at 0x107fd9d20>
314.0000,8.000,1,33,2,nonjoke,Some people think courtship is the first in a series of steps leading to ,divorce,romance,Some people think courtship is the first in a series of steps leading to romance.,<VisionEgg.WrappedText.WrappedText object at 0x107fd9dc0>
322.0000,8.000,1,52,2,joke,My wife did natural childbirth: no,makeup,anesthetic,My wife did natural childbirth: no makeup.,<VisionEgg.WrappedText.WrappedText object at 0x107fd9e10>
330.0000,2.000,fix
332.0000,8.000,1,91,2,nonjoke,"If there's one thing that counts in business, its",bookkeepers,resources,"If there's one thing that counts in business, its resources.",<VisionEgg.WrappedText.WrappedText object at 0x107fd9f00>
340.0000,10.000,fix
350.0000,8.000,1,41,2,nonjoke,His doctor recommended he stay flat on his back ever since he was hit by a ,steamroller,motorist,His doctor recommended he stay flat on his back ever since he was hit by a motorist.,<VisionEgg.WrappedText.WrappedText object at 0x107fd9fa0>
358.0000,6.000,fix
364.0000,8.000,1,80,2,joke,He says he doesn't like to drink because it makes him feel,happy,sad,He says he doesn't like to drink because it makes him feel happy.,<VisionEgg.WrappedText.WrappedText object at 0x1109840a0>
372.0000,8.000,1,131,2,nonjoke,"Statistics indicate that Americans spend eighty million a year on games of chance, mostly",weddings, blackjack,"Statistics indicate that Americans spend eighty million a year on games of chance, mostly blackjack.",<VisionEgg.WrappedText.WrappedText object at 0x110984140>
380.0000,6.000,fix
386.0000,8.000,1,99,2,nonjoke,"He's never given a girl a present, but he did give a few a pretty good",reputation,surprise,"He's never given a girl a present, but he did give a few a pretty good surprise.",<VisionEgg.WrappedText.WrappedText object at 0x110984230>
394.0000,4.000,fix
398.0000,8.000,1,6,2,joke,Sunday is the day we bow our heads and,putt,rest,Sunday is the day we bow our heads and putt.,<VisionEgg.WrappedText.WrappedText object at 0x110984320>
406.0000,4.000,fix
410.0000,8.000,1,119,2,nonjoke,"He told me he's not broke, just badly",bent,off,"He told me he's not broke, just badly off.",<VisionEgg.WrappedText.WrappedText object at 0x1109843c0>
418.0000,4.000,fix
422.0000,8.000,1,116,2,joke,Autobiography is an unrivaled vehicle for telling the truth about,others,somebody,Autobiography is an unrivaled vehicle for telling the truth about others.,<VisionEgg.WrappedText.WrappedText object at 0x110984410>
430.0000,4.000,fix
434.0000,8.000,1,11,2,nonjoke,"He owns stock in a company that pays quarterly dividends, so every three months they send him a",quarter,statement,"He owns stock in a company that pays quarterly dividends, so every three months they send him a statement.",<VisionEgg.WrappedText.WrappedText object at 0x110984500>
442.0000,8.000,1,74,2,joke,He's planning an extended vacation; he hopes to spend three weeks on his,couch,sailboat,He's planning an extended vacation; he hopes to spend three weeks on his couch.,<VisionEgg.WrappedText.WrappedText object at 0x1109845a0>
450.0000,8.000,1,76,2,joke,"Parents support clubs for teenagers, especially when they lack other forms of",punishment,diversion,"Parents support clubs for teenagers, especially when they lack other forms of punishment.",<VisionEgg.WrappedText.WrappedText object at 0x1109845f0>
458.0000,2.000,fix
460.0000,8.000,1,2,2,joke,"She went on a fourteen day diet, but she only lost two",weeks,ounces,"She went on a fourteen day diet, but she only lost two weeks.",<VisionEgg.WrappedText.WrappedText object at 0x1109846e0>
468.0000,8.000,1,75,2,nonjoke,"When reviewing your notes for a test, the most important ones will be",illegible,capitalized,"When reviewing your notes for a test, the most important ones will be capitalized.",<VisionEgg.WrappedText.WrappedText object at 0x110984820>
476.0000,2.000,fix
478.0000,8.000,1,62,2,joke,"I can walk on water, but I stagger on ",alcohol,concrete,"I can walk on water, but I stagger on alcohol.",<VisionEgg.WrappedText.WrappedText object at 0x110984910>
486.0000,22.000,fix
508.0000,8.000,1,20,2,joke,"He told me he just bought a set of balloon tires, and I told him I didn't even know he owned a",balloon,truck,"He told me he just bought a set of balloon tires, and I told him I didn't even know he owned a balloon.",<VisionEgg.WrappedText.WrappedText object at 0x1109849b0>
516.0000,8.000,1,64,2,joke,The best way to stop an elephant from charging is to cut off its,credit,toes,The best way to stop an elephant from charging is to cut off its credit.,<VisionEgg.WrappedText.WrappedText object at 0x110984aa0>
524.0000,2.000,fix
526.0000,8.000,1,110,2,joke,It's not hard to meet expenses; they're ,everywhere,affordable,It's not hard to meet expenses; they're everywhere.,<VisionEgg.WrappedText.WrappedText object at 0x110984b40>
534.0000,8.000,1,46,2,joke,Arguments between couples are healthy; sometimes they even prevent,marriage,breakups,Arguments between couples are healthy; sometimes they even prevent marriage.,<VisionEgg.WrappedText.WrappedText object at 0x110984be0>
542.0000,2.000,fix
544.0000,8.000,1,42,2,joke,The best way to keep the milk from turning sour is to keep it in the,cow,cold,The best way to keep the milk from turning sour is to keep it in the cow.,<VisionEgg.WrappedText.WrappedText object at 0x110984cd0>
552.0000,10.000,fix
562.0000,8.000,1,22,2,joke,Our son brought home a note from school saying they need a written excuse for his,presence,tardiness,Our son brought home a note from school saying they need a written excuse for his presence.,<VisionEgg.WrappedText.WrappedText object at 0x110984d70>
